{
  "schema_version": "1.0.0",
  "id": "tomb_01K0ABCDEFFGHJKMNPQRSTVWXG",
  "publication_id": "pub_01K0ABCDEFFGHJKMNPQRSTVWXY",
  "canonical_path": "/2026/07/20/a-cidade-terceirizou-o-relogio/",
  "title": "A cidade terceirizou o relógio",
  "reason": "A fonte central não sustentava a identificação publicada da empresa responsável.",
  "impact": "O corpo foi ocultado, mas o registro e o motivo da retirada permanecem públicos.",
  "published_at": "2026-07-20T19:00:00-03:00",
  "original_published_at": "2026-07-20T15:00:00-03:00",
  "body_hidden": true
}
